{
  "test_id": "EC-101",
  "requirement_ref": {
    "source": "DOC",
    "locator": "input/feature-ecommerce/requirement.md",
    "quote": "A shopper can filter the product list by category.",
    "content_hash": "sha256:d93f44e1b0b4bfbdddc722d0c87757eb"
  },
  "feature": "ecommerce",
  "capability": "Catalogue.Filter",
  "priority": "P1",
  "actor": "a shopper browsing anonymously",
  "test_objective": "Filtering by Electronics narrows the product list to electronics only.",
  "expected_outcome": "succeeds",
  "preconditions": [
    "the catalogue contains products in more than one category"
  ],
  "coverage": {
    "category": "functional",
    "secondary_categories": [
      "navigation"
    ],
    "execution_mode": "automated"
  },
  "steps": [
    {
      "id": "S1",
      "actor_intent": "arrive at the storefront as an anonymous shopper"
    },
    {
      "id": "S2",
      "actor_intent": "narrow the catalogue to the Electronics category"
    }
  ],
  "outcomes": [
    {
      "id": "O1",
      "statement": "Only products belonging to Electronics remain listed.",
      "observable": "state_change"
    },
    {
      "id": "O2",
      "statement": "The Electronics category is shown as the one currently applied.",
      "observable": "element_present"
    }
  ],
  "not_verifiable_yet": [
    "That the filtered set matches what the catalogue API returns for Electronics — comparing UI against backend needs an HTTP client the executor does not have."
  ],
  "approval": {
    "approved_by": "jay.r",
    "approved_at": "2026-09-12T14:17:05.892Z",
    "edits_made": false,
    "review_minutes": 2
  }
}
