{
  "test_id": "LG-002",
  "requirement_ref": {
    "source": "DOC",
    "locator": "input/feature-login/requirement.md",
    "quote": "If the email or the password is wrong, the user is not signed in and is shown an error.",
    "content_hash": "sha256:0a68fdf801636466611636d7f02f03c9"
  },
  "depends_on_clarifications": [
    "Q-2"
  ],
  "feature": "login",
  "capability": "Auth.SignIn",
  "priority": "P0",
  "actor": "an unauthenticated visitor",
  "test_objective": "A registered user supplying the wrong password is refused with the neutral message.",
  "expected_outcome": "blocked",
  "preconditions": [
    "the account exists and is in good standing",
    "the account is not locked from earlier attempts"
  ],
  "test_data": [
    {
      "name": "known_account",
      "description": "a registered account in good standing whose password is known to the test",
      "provisioning": "seeded",
      "disposable": false
    }
  ],
  "coverage": {
    "category": "negative",
    "secondary_categories": [
      "security"
    ],
    "execution_mode": "automated"
  },
  "steps": [
    {
      "id": "S1",
      "actor_intent": "arrive at the sign-in screen as an unauthenticated visitor"
    },
    {
      "id": "S2",
      "actor_intent": "submit the registered email address with a password that is not the account's",
      "data_ref": "known_account"
    }
  ],
  "outcomes": [
    {
      "id": "O1",
      "statement": "The user is told the email and password do not match, in the neutral wording agreed in Q-2.",
      "observable": "message_shown",
      "note": "Asserting the refusal itself, not only the absence of a session. 'Not signed in' is equally true of a correct refusal and of a crash."
    },
    {
      "id": "O2",
      "statement": "The user is not signed in and does not reach the dashboard.",
      "observable": "access_denied"
    },
    {
      "id": "O3",
      "statement": "The message does not reveal whether the email address is registered.",
      "observable": "message_shown",
      "note": "The user-enumeration guarantee from Q-2. Worth its own outcome because it can regress independently of O1."
    }
  ],
  "not_verifiable_yet": [
    "That no timing difference distinguishes a registered from an unregistered address — a timing side channel is a real enumeration vector and the browser executor cannot measure it."
  ],
  "approval": {
    "approved_by": "jay.r",
    "approved_at": "2026-09-12T13:40:55.451Z",
    "edits_made": false,
    "review_minutes": 3,
    "clarification_hashes": {
      "Q-2": "sha256:4c0c7543e2567fff9db5d04f197eff0c"
    }
  }
}
