{
  "test_id": "EC-102",
  "requirement_ref": {
    "source": "DOC",
    "locator": "input/feature-ecommerce/requirement.md",
    "quote": "A shopper can add a product to their cart from the product list.",
    "content_hash": "sha256:d93f44e1b0b4bfbdddc722d0c87757eb"
  },
  "feature": "ecommerce",
  "capability": "Cart.Add",
  "priority": "P0",
  "actor": "a shopper browsing anonymously",
  "test_objective": "A product added from the list appears in the cart.",
  "expected_outcome": "succeeds",
  "preconditions": [
    "the cart is empty",
    "at least one product is in stock"
  ],
  "coverage": {
    "category": "functional",
    "execution_mode": "automated"
  },
  "steps": [
    {
      "id": "S1",
      "actor_intent": "arrive at the storefront as an anonymous shopper"
    },
    {
      "id": "S2",
      "actor_intent": "add the first listed product to the cart"
    },
    {
      "id": "S3",
      "actor_intent": "open the cart"
    }
  ],
  "outcomes": [
    {
      "id": "O1",
      "statement": "The product just added is listed in the cart.",
      "observable": "element_present"
    },
    {
      "id": "O2",
      "statement": "The cart total reflects that product's price.",
      "observable": "value_equals"
    }
  ],
  "not_verifiable_yet": [
    "That the cart survives a session restart — needs a second browser context mid-mission."
  ],
  "approval": {
    "approved_by": "jay.r",
    "approved_at": "2026-09-12T14:17:08.425Z",
    "edits_made": false,
    "review_minutes": 2
  }
}
