{
  "test_id": "LG-004",
  "requirement_ref": {
    "source": "DOC",
    "locator": "input/feature-login/requirement.md",
    "quote": "Repeated failed attempts must not allow brute-forcing an account.",
    "content_hash": "sha256:0a68fdf801636466611636d7f02f03c9"
  },
  "depends_on_clarifications": [
    "Q-1"
  ],
  "feature": "login",
  "capability": "Auth.SignIn",
  "priority": "P0",
  "actor": "an unauthenticated visitor",
  "test_objective": "Repeated wrong passwords stop the account being brute-forced.",
  "expected_outcome": "blocked",
  "preconditions": [
    "the account exists and has no prior failed attempts against it"
  ],
  "test_data": [
    {
      "name": "throwaway_account",
      "description": "a registered account this test may render unusable",
      "provisioning": "created_by_test",
      "disposable": true
    }
  ],
  "coverage": {
    "category": "security",
    "secondary_categories": [
      "negative",
      "error_handling"
    ],
    "execution_mode": "automated"
  },
  "steps": [
    {
      "id": "S1",
      "actor_intent": "arrive at the sign-in screen as an unauthenticated visitor"
    },
    {
      "id": "S2",
      "actor_intent": "submit the wrong password repeatedly, up to the threshold agreed in Q-1",
      "data_ref": "throwaway_account"
    },
    {
      "id": "S3",
      "actor_intent": "make one further attempt past the threshold",
      "data_ref": "throwaway_account"
    }
  ],
  "outcomes": [
    {
      "id": "O1",
      "statement": "The further attempt is refused by the protection agreed in Q-1, and the user is told what happened.",
      "observable": "message_shown"
    },
    {
      "id": "O2",
      "statement": "Supplying the CORRECT password during the protection window still does not sign the user in.",
      "observable": "access_denied",
      "note": "The outcome that decides whether the protection is real. A limiter that waves through a correct password protects nothing, and a test that never tries it would pass against exactly that bug."
    }
  ],
  "not_verifiable_yet": [
    "Whether the limit is per-account or per-IP — distinguishing them needs a second source address the executor does not have.",
    "Whether the protection expires correctly after the stated window — needs either a clock the test controls or a wait too long to sit in a smoke run."
  ],
  "approval": {
    "approved_by": "jay.r",
    "approved_at": "2026-09-12T13:41:11.165Z",
    "edits_made": false,
    "review_minutes": 4,
    "clarification_hashes": {
      "Q-1": "sha256:a57aebcc2f776cba5bedf3908dd7c46b"
    }
  }
}
