{
  "test_id": "LG-006",
  "requirement_ref": {
    "source": "DOC",
    "locator": "input/feature-login/requirement.md",
    "quote": "The sign-in form offers a \"stay signed in\" option.",
    "content_hash": "sha256:0a68fdf801636466611636d7f02f03c9"
  },
  "depends_on_clarifications": [
    "Q-3"
  ],
  "feature": "login",
  "capability": "Auth.Session",
  "priority": "P1",
  "actor": "a registered user",
  "test_objective": "Choosing to stay signed in keeps the session alive across a browser restart.",
  "expected_outcome": "succeeds",
  "preconditions": [
    "the account exists and is in good standing"
  ],
  "test_data": [
    {
      "name": "known_account",
      "description": "a registered account in good standing whose password is known to the test",
      "provisioning": "seeded",
      "disposable": false
    }
  ],
  "coverage": {
    "category": "functional",
    "secondary_categories": [
      "security"
    ],
    "execution_mode": "automated"
  },
  "steps": [
    {
      "id": "S1",
      "actor_intent": "arrive at the sign-in screen as an unauthenticated visitor"
    },
    {
      "id": "S2",
      "actor_intent": "sign in with valid credentials, choosing to stay signed in",
      "data_ref": "known_account"
    },
    {
      "id": "S3",
      "actor_intent": "close the browser entirely and return to the application"
    }
  ],
  "outcomes": [
    {
      "id": "O1",
      "statement": "The user is still signed in and reaches their dashboard without signing in again.",
      "observable": "state_change"
    }
  ],
  "not_verifiable_yet": [
    "That the session actually lasts the full window assumed in Q-3. A smoke run proves the session survives a restart; it cannot sit for 30 days, and no clock the test controls has been agreed."
  ],
  "assumption": true,
  "approval": {
    "approved_by": "jay.r",
    "approved_at": "2026-09-12T13:40:57.810Z",
    "edits_made": false,
    "review_minutes": 2,
    "clarification_hashes": {
      "Q-3": "sha256:2cf685db750f4622f002b6d9b411b0c2"
    }
  }
}
